{
  "schema_version":1,"name":"strict paid plus pain",
  "positive_markers":{"pain":["manual","repetitive","error-prone","backlog","takes hours","spends hours","rework"],"buy":["looking for","seeking","request a quote","requests a quote"],"paid":["budget","contractor","fixed-price","freelancer","looking to hire","quote"]},
  "negative_markers":["disconfirm","already automated","job vacancy","interview","market trends"],
  "negations":["no budget","no purchase intent","not looking to hire"],
  "weights":{"pain":3,"buy":2,"paid":5,"negative":5},
  "thresholds":{"demand_score_min":8,"vendor_fp_rate_max":0.0},
  "vendor_exclusion":{"enabled":true,"source_types":["generic_web"],"markers":["free trial","book a demo","book a call","we provide","we offer","hire our","our experts","pricing plans"]}
}
