{
  "schema_version":1,"name":"permissive paid markers",
  "positive_markers":{"pain":["manual","repetitive","pain","problem","backlog"],"buy":["looking for","need","wants","recommend"],"paid":["pricing","price","paid","budget","hire","quote","subscription"]},
  "negative_markers":["disconfirm"],"negations":["no budget","no purchase intent"],
  "weights":{"pain":2,"buy":2,"paid":3,"negative":2},
  "thresholds":{"demand_score_min":4,"vendor_fp_rate_max":0.0},
  "vendor_exclusion":{"enabled":false,"source_types":[],"markers":[]}
}
